{
  "$schema": "https://w3id.org/moca/schemas/v1/manifest.schema.json",
  "mocaVersion": "0.2",
  "id": "https://example.com/moca/support-kb-governed",
  "version": "1.0.0",
  "title": "Support answers with data-governance notes",
  "language": "en",
  "profiles": {
    "https://w3id.org/moca/profiles/eu-ai-act/v1": {
      "regulation": "Regulation (EU) 2024/1689",
      "dataGovernance": {
        "sources": [
          "Acme Customer Terms 2026"
        ],
        "collectionPeriod": {
          "from": "2026-01-01",
          "to": "2026-08-31"
        },
        "preparation": [
          "reviewed by the support policy owner"
        ],
        "knownGaps": [
          "no content for business customers"
        ],
        "personalData": "none"
      },
      "syntheticContent": {
        "present": true,
        "marking": "okf-generated"
      }
    }
  }
}
