{
  "id": "https://example.com/conformance/book-mismatch",
  "version": "1.0.0",
  "title": "Fixture",
  "members": [
    {
      "id": "https://example.com/conformance/chapter-a",
      "version": "1.0.0",
      "digest": "sha256:aaaaaaaaaaaaaaaaaaaaaaaaaaaaaaaaaaaaaaaaaaaaaaaaaaaaaaaaaaaaaaaa"
    }
  ]
}
